{
  "contractVersion": "2.0",
  "workspace": {
    "workspaceId": "workspace-default",
    "workspaceCode": "default",
    "displayName": "默认工作空间"
  },
  "commandId": "5e8b3db2-6f0f-4597-b4a8-0d0052664762",
  "workflowId": "0a1693e5-91e8-4543-9a77-190b50a6df11",
  "idempotencyKey": "node-health:node-a:2026-06-13",
  "operationClass": "READ_ONLY",
  "targetEnvironment": "development",
  "skill": {
    "skillId": "node-health-read",
    "version": "1.1.0",
    "parameterSchemaId": "node-health-read:1.1.0:input",
    "outputSchemaId": "node-health-read:1.1.0:output"
  },
  "parameters": {
    "nodeName": "node-a"
  },
  "operator": {
    "operatorId": "operator-demo",
    "roles": ["ROLE_ops-reader"]
  },
  "policyDecision": {
    "decisionId": "decision-demo",
    "policyVersion": "policy-v1",
    "decision": "ALLOW"
  },
  "trace": {
    "traceId": "trace-demo",
    "requestId": "request-demo"
  },
  "requestedAt": "2026-06-13T00:00:00Z"
}
